{"apiVersion":"a1os/v1","kind":"Workflow","metadata":{"id":"cache.redis.provision","version":"1.0.0"},"spec":{"capability":{"id":"cache.redis"},"inputs":{"environment":"string","mode":"single|sentinel|cluster","replicas":"integer"},"prerequisites":["networking.available","storage.available","secrets.available"],"stages":[{"id":"validate","executor":"internal.validate"},{"id":"provision","executor":"docker"},{"id":"configure","executor":"ansible"},{"id":"secure","executor":"ansible"},{"id":"verify","executor":"cache.redis.verifier"}],"verification":["health","connectivity","persistence","replication","monitoring"],"rollback":{"workflow":"cache.redis.decommission"},"destructive":false}}