{"apiVersion":"a1os/v1","kind":"Workflow","metadata":{"id":"database.postgresql.provision","version":"1.0.0"},"spec":{"capability":{"id":"database.postgresql"},"inputs":{"environment":"string","storage":"string","replicas":"integer"},"prerequisites":["networking.available","storage.available","secrets.available"],"stages":[{"id":"validate","executor":"internal.validate"},{"id":"provision","executor":"terraform"},{"id":"configure","executor":"ansible"},{"id":"secure","executor":"ansible"},{"id":"verify","executor":"database.postgresql.verifier"}],"verification":["health","connectivity","configuration","backup","monitoring"],"rollback":{"workflow":"database.postgresql.decommission"},"destructive":false}}