{"apiVersion":"a1os/v1","kind":"Workflow","metadata":{"id":"infrastructure.ansible.configure","version":"1.0.0"},"spec":{"capability":{"id":"infrastructure.ansible"},"inputs":{"inventory":"string","playbook":"string","check":"boolean"},"prerequisites":["ansible.available","networking.available","secrets.available"],"stages":[{"id":"lint","executor":"ansible"},{"id":"check","executor":"ansible"},{"id":"apply","executor":"ansible"},{"id":"verify","executor":"infrastructure.ansible.verifier"}],"verification":["syntax","idempotency","configuration","health"],"rollback":{"workflow":"infrastructure.ansible.rollback"},"destructive":false}}