{"apiVersion":"a1os/v1","kind":"Workflow","metadata":{"id":"messaging.kafka.provision","version":"1.0.0"},"spec":{"capability":{"id":"messaging.kafka"},"inputs":{"environment":"string","brokers":"integer","partitions":"integer","replication_factor":"integer"},"prerequisites":["networking.available","storage.available","secrets.available"],"stages":[{"id":"validate","executor":"internal.validate"},{"id":"provision","executor":"terraform"},{"id":"configure","executor":"ansible"},{"id":"secure","executor":"ansible"},{"id":"verify","executor":"messaging.kafka.verifier"}],"verification":["broker","controller","topic","consumer_lag","monitoring"],"rollback":{"workflow":"messaging.kafka.decommission"},"destructive":false}}