{"apiVersion":"a1os/v1","kind":"Workflow","metadata":{"id":"networking.nginx.provision","version":"1.0.0"},"spec":{"capability":{"id":"networking.nginx"},"inputs":{"environment":"string","upstreams":"object","tls":"object"},"prerequisites":["networking.available","secrets.available"],"stages":[{"id":"validate","executor":"internal.validate"},{"id":"provision","executor":"docker"},{"id":"configure","executor":"ansible"},{"id":"secure","executor":"ansible"},{"id":"verify","executor":"networking.nginx.verifier"}],"verification":["configuration","tls","upstream","health","observability"],"rollback":{"workflow":"networking.nginx.rollback"},"destructive":false}}