{"apiVersion":"a1os/v1","kind":"Workflow","metadata":{"id":"infrastructure.docker.provision","version":"1.0.0"},"spec":{"capability":{"id":"infrastructure.docker"},"inputs":{"image":"string","name":"string","ports":"array","environment":"object"},"prerequisites":["docker.available","networking.available","secrets.available"],"stages":[{"id":"validate","executor":"internal.validate"},{"id":"pull","executor":"docker"},{"id":"run","executor":"docker"},{"id":"verify","executor":"infrastructure.docker.verifier"}],"verification":["daemon","container","image","network","health"],"rollback":{"workflow":"infrastructure.docker.decommission"},"destructive":false}}