{"apiVersion":"a1os/v1","kind":"Workflow","metadata":{"id":"infrastructure.terraform.plan","version":"1.0.0"},"spec":{"capability":{"id":"infrastructure.terraform"},"inputs":{"directory":"string","workspace":"string"},"prerequisites":["terraform.available","state.available","secrets.available"],"stages":[{"id":"validate","executor":"terraform"},{"id":"plan","executor":"terraform"},{"id":"verify","executor":"infrastructure.terraform.verifier"}],"verification":["syntax","plan","state","drift"],"rollback":{"workflow":"infrastructure.terraform.rollback"},"destructive":false}}