{"apiVersion":"a1os/v1","kind":"Workflow","metadata":{"id":"observability.core.provision","version":"1.0.0"},"spec":{"capability":{"id":"observability.core"},"inputs":{"metrics":"boolean","logs":"boolean","traces":"boolean","retention":"string"},"prerequisites":["networking.available","storage.available"],"stages":[{"id":"validate","executor":"internal.validate"},{"id":"configure","executor":"ansible"},{"id":"instrument","executor":"api"},{"id":"verify","executor":"observability.core.verifier"}],"verification":["metrics","logs","health","alerts"],"rollback":{"workflow":"observability.core.decommission"},"destructive":false}}