{"apiVersion":"a1os/v1","kind":"Workflow","metadata":{"id":"infrastructure.kubernetes.provision","version":"1.0.0"},"spec":{"capability":{"id":"infrastructure.kubernetes"},"inputs":{"provider":"string","cluster":"string","region":"string"},"prerequisites":["networking.available","storage.available","secrets.available","observability.available"],"stages":[{"id":"validate","executor":"internal.validate"},{"id":"provision","executor":"terraform"},{"id":"configure","executor":"ansible"},{"id":"verify","executor":"infrastructure.kubernetes.verifier"}],"verification":["cluster","nodes","workload","service","policy","monitoring"],"rollback":{"workflow":"infrastructure.kubernetes.decommission"},"destructive":true}}