{"apiVersion":"a1os/v1","kind":"Workflow","metadata":{"id":"security.secrets.provision","version":"1.0.0"},"spec":{"capability":{"id":"security.secrets"},"inputs":{"provider":"string","namespace":"string","rotation_policy":"object"},"prerequisites":["identity.available","authorization.available","audit.available"],"stages":[{"id":"validate","executor":"internal.validate"},{"id":"provision","executor":"api"},{"id":"policy","executor":"api"},{"id":"verify","executor":"security.secrets.verifier"}],"verification":["access_policy","encryption","rotation","audit"],"rollback":{"workflow":"security.secrets.decommission"},"destructive":true}}